[32m2026-01-08 16:40:46 -0700[0m - dagster - [34mDEBUG[0m - monthly_ingestion - ca689360-9d5b-4cee-be68-4d926d9be3b8 - 49984 - LOGS_CAPTURED - Started capturing logs in process (pid: 49984).
[32m2026-01-08 16:40:46 -0700[0m - dagster - [34mDEBUG[0m - monthly_ingestion - ca689360-9d5b-4cee-be68-4d926d9be3b8 - 49984 - monthly_ge_validation - STEP_START - Started execution of step "monthly_ge_validation".
[32m2026-01-08 16:40:46 -0700[0m - dagster - [34mDEBUG[0m - monthly_ingestion - ca689360-9d5b-4cee-be68-4d926d9be3b8 - monthly_ge_validation - Loading file from: /Users/brandoncgay/Documents/Projects/nyc-mobility-weather-analytics/tmpjnvmf9r0/storage/monthly_dbt_transformation using PickledObjectFilesystemIOManager...
[32m2026-01-08 16:40:46 -0700[0m - dagster - [34mDEBUG[0m - monthly_ingestion - ca689360-9d5b-4cee-be68-4d926d9be3b8 - 49984 - monthly_ge_validation - LOADED_INPUT - Loaded input "monthly_dbt_transformation" using input manager "io_manager", from output "result" of step "monthly_dbt_transformation"
[32m2026-01-08 16:40:46 -0700[0m - dagster - [34mDEBUG[0m - monthly_ingestion - ca689360-9d5b-4cee-be68-4d926d9be3b8 - 49984 - monthly_ge_validation - STEP_INPUT - Got input "monthly_dbt_transformation" of type "dict". (Type check passed).
[32m2026-01-08 16:40:46 -0700[0m - dagster - [34mINFO[0m - monthly_ingestion - ca689360-9d5b-4cee-be68-4d926d9be3b8 - monthly_ge_validation - Running Great Expectations validations for 2025-07
[32m2026-01-08 16:40:48 -0700[0m - dagster - [34mINFO[0m - monthly_ingestion - ca689360-9d5b-4cee-be68-4d926d9be3b8 - monthly_ge_validation - Running 5 validation suites...
[32m2026-01-08 16:40:48 -0700[0m - dagster - [34mINFO[0m - monthly_ingestion - ca689360-9d5b-4cee-be68-4d926d9be3b8 - monthly_ge_validation -   Validating stg_yellow_taxi...
Calculating Metrics:   0%|          | 0/45 [00:00<?, ?it/s]Calculating Metrics:   0%|          | 0/45 [00:00<?, ?it/s]Calculating Metrics:   0%|          | 0/45 [00:00<?, ?it/s]Calculating Metrics:   0%|          | 0/45 [00:00<?, ?it/s]Calculating Metrics:   0%|          | 0/45 [00:00<?, ?it/s]Calculating Metrics:   2%|▁         | 1/45 [00:00<00:02, 17.04it/s]Calculating Metrics:   2%|▁         | 1/45 [00:00<00:02, 15.09it/s]Calculating Metrics:   2%|▁         | 1/45 [00:00<00:03, 12.90it/s]Calculating Metrics:   2%|▁         | 1/45 [00:00<00:03, 11.37it/s]Calculating Metrics:   2%|▁         | 1/45 [00:00<00:04, 10.20it/s]Calculating Metrics:   2%|▁         | 1/45 [00:00<00:04, 10.18it/s]Calculating Metrics:   2%|▁         | 1/45 [00:00<00:04, 10.17it/s]
[32m2026-01-08 16:40:53 -0700[0m - dagster - [34mWARNING[0m - monthly_ingestion - ca689360-9d5b-4cee-be68-4d926d9be3b8 - monthly_ge_validation -     ❌ stg_yellow_taxi failed
[32m2026-01-08 16:40:53 -0700[0m - dagster - [34mWARNING[0m - monthly_ingestion - ca689360-9d5b-4cee-be68-4d926d9be3b8 - monthly_ge_validation -       Failed expectations: 7
[32m2026-01-08 16:40:53 -0700[0m - dagster - [34mWARNING[0m - monthly_ingestion - ca689360-9d5b-4cee-be68-4d926d9be3b8 - monthly_ge_validation -         - expect_table_row_count_to_be_between
[32m2026-01-08 16:40:53 -0700[0m - dagster - [34mWARNING[0m - monthly_ingestion - ca689360-9d5b-4cee-be68-4d926d9be3b8 - monthly_ge_validation -         - expect_column_values_to_not_be_null
[32m2026-01-08 16:40:53 -0700[0m - dagster - [34mWARNING[0m - monthly_ingestion - ca689360-9d5b-4cee-be68-4d926d9be3b8 - monthly_ge_validation -         - expect_column_values_to_be_unique
[32m2026-01-08 16:40:53 -0700[0m - dagster - [34mINFO[0m - monthly_ingestion - ca689360-9d5b-4cee-be68-4d926d9be3b8 - monthly_ge_validation -   Validating stg_fhv_taxi...
Calculating Metrics:   0%|          | 0/21 [00:00<?, ?it/s]Calculating Metrics:   0%|          | 0/21 [00:00<?, ?it/s]Calculating Metrics:   0%|          | 0/21 [00:00<?, ?it/s]Calculating Metrics:   0%|          | 0/21 [00:00<?, ?it/s]Calculating Metrics:   0%|          | 0/21 [00:00<?, ?it/s]Calculating Metrics:   5%|▁         | 1/21 [00:00<00:00, 47.65it/s]Calculating Metrics:   5%|▁         | 1/21 [00:00<00:00, 41.63it/s]Calculating Metrics:   5%|▁         | 1/21 [00:00<00:00, 34.88it/s]Calculating Metrics:   5%|▁         | 1/21 [00:00<00:00, 30.18it/s]Calculating Metrics:   5%|▁         | 1/21 [00:00<00:00, 26.26it/s]Calculating Metrics:   5%|▁         | 1/21 [00:00<00:00, 26.12it/s]Calculating Metrics:   5%|▁         | 1/21 [00:00<00:00, 26.08it/s]
[32m2026-01-08 16:40:55 -0700[0m - dagster - [34mWARNING[0m - monthly_ingestion - ca689360-9d5b-4cee-be68-4d926d9be3b8 - monthly_ge_validation -     ❌ stg_fhv_taxi failed
[32m2026-01-08 16:40:55 -0700[0m - dagster - [34mWARNING[0m - monthly_ingestion - ca689360-9d5b-4cee-be68-4d926d9be3b8 - monthly_ge_validation -       Failed expectations: 4
[32m2026-01-08 16:40:55 -0700[0m - dagster - [34mWARNING[0m - monthly_ingestion - ca689360-9d5b-4cee-be68-4d926d9be3b8 - monthly_ge_validation -         - expect_table_row_count_to_be_between
[32m2026-01-08 16:40:55 -0700[0m - dagster - [34mWARNING[0m - monthly_ingestion - ca689360-9d5b-4cee-be68-4d926d9be3b8 - monthly_ge_validation -         - expect_column_values_to_not_be_null
[32m2026-01-08 16:40:55 -0700[0m - dagster - [34mWARNING[0m - monthly_ingestion - ca689360-9d5b-4cee-be68-4d926d9be3b8 - monthly_ge_validation -         - expect_column_values_to_be_unique
[32m2026-01-08 16:40:55 -0700[0m - dagster - [34mINFO[0m - monthly_ingestion - ca689360-9d5b-4cee-be68-4d926d9be3b8 - monthly_ge_validation -   Validating stg_citibike__trips...
Calculating Metrics:   0%|          | 0/30 [00:00<?, ?it/s]Calculating Metrics:   0%|          | 0/30 [00:00<?, ?it/s]Calculating Metrics:   0%|          | 0/30 [00:00<?, ?it/s]Calculating Metrics:   0%|          | 0/30 [00:00<?, ?it/s]Calculating Metrics:   0%|          | 0/30 [00:00<?, ?it/s]Calculating Metrics:   3%|▎         | 1/30 [00:00<00:00, 38.70it/s]Calculating Metrics:   3%|▎         | 1/30 [00:00<00:00, 32.93it/s]Calculating Metrics:   3%|▎         | 1/30 [00:00<00:01, 27.94it/s]Calculating Metrics:   3%|▎         | 1/30 [00:00<00:01, 24.20it/s]Calculating Metrics:   3%|▎         | 1/30 [00:00<00:01, 21.41it/s]Calculating Metrics:   3%|▎         | 1/30 [00:00<00:01, 21.35it/s]Calculating Metrics:   3%|▎         | 1/30 [00:00<00:01, 21.33it/s]
[32m2026-01-08 16:40:55 -0700[0m - dagster - [34mWARNING[0m - monthly_ingestion - ca689360-9d5b-4cee-be68-4d926d9be3b8 - monthly_ge_validation -     ❌ stg_citibike__trips failed
[32m2026-01-08 16:40:55 -0700[0m - dagster - [34mWARNING[0m - monthly_ingestion - ca689360-9d5b-4cee-be68-4d926d9be3b8 - monthly_ge_validation -       Failed expectations: 5
[32m2026-01-08 16:40:55 -0700[0m - dagster - [34mWARNING[0m - monthly_ingestion - ca689360-9d5b-4cee-be68-4d926d9be3b8 - monthly_ge_validation -         - expect_table_row_count_to_be_between
[32m2026-01-08 16:40:55 -0700[0m - dagster - [34mWARNING[0m - monthly_ingestion - ca689360-9d5b-4cee-be68-4d926d9be3b8 - monthly_ge_validation -         - expect_column_values_to_not_be_null
[32m2026-01-08 16:40:55 -0700[0m - dagster - [34mWARNING[0m - monthly_ingestion - ca689360-9d5b-4cee-be68-4d926d9be3b8 - monthly_ge_validation -         - expect_column_values_to_be_unique
[32m2026-01-08 16:40:55 -0700[0m - dagster - [34mINFO[0m - monthly_ingestion - ca689360-9d5b-4cee-be68-4d926d9be3b8 - monthly_ge_validation -   Validating stg_weather__hourly...
Calculating Metrics:   0%|          | 0/33 [00:00<?, ?it/s]Calculating Metrics:   0%|          | 0/33 [00:00<?, ?it/s]Calculating Metrics:   0%|          | 0/33 [00:00<?, ?it/s]Calculating Metrics:   0%|          | 0/33 [00:00<?, ?it/s]Calculating Metrics:   0%|          | 0/33 [00:00<?, ?it/s]Calculating Metrics:   3%|▎         | 1/33 [00:00<00:00, 32.04it/s]Calculating Metrics:   3%|▎         | 1/33 [00:00<00:01, 27.26it/s]Calculating Metrics:   3%|▎         | 1/33 [00:00<00:01, 23.17it/s]Calculating Metrics:   3%|▎         | 1/33 [00:00<00:01, 20.21it/s]Calculating Metrics:   3%|▎         | 1/33 [00:00<00:01, 17.97it/s]Calculating Metrics:   3%|▎         | 1/33 [00:00<00:01, 17.93it/s]Calculating Metrics:   3%|▎         | 1/33 [00:00<00:01, 17.92it/s]
[32m2026-01-08 16:40:55 -0700[0m - dagster - [34mWARNING[0m - monthly_ingestion - ca689360-9d5b-4cee-be68-4d926d9be3b8 - monthly_ge_validation -     ❌ stg_weather__hourly failed
[32m2026-01-08 16:40:55 -0700[0m - dagster - [34mWARNING[0m - monthly_ingestion - ca689360-9d5b-4cee-be68-4d926d9be3b8 - monthly_ge_validation -       Failed expectations: 5
[32m2026-01-08 16:40:55 -0700[0m - dagster - [34mWARNING[0m - monthly_ingestion - ca689360-9d5b-4cee-be68-4d926d9be3b8 - monthly_ge_validation -         - expect_table_row_count_to_be_between
[32m2026-01-08 16:40:55 -0700[0m - dagster - [34mWARNING[0m - monthly_ingestion - ca689360-9d5b-4cee-be68-4d926d9be3b8 - monthly_ge_validation -         - expect_column_values_to_not_be_null
[32m2026-01-08 16:40:55 -0700[0m - dagster - [34mWARNING[0m - monthly_ingestion - ca689360-9d5b-4cee-be68-4d926d9be3b8 - monthly_ge_validation -         - expect_column_values_to_be_unique
[32m2026-01-08 16:40:55 -0700[0m - dagster - [34mINFO[0m - monthly_ingestion - ca689360-9d5b-4cee-be68-4d926d9be3b8 - monthly_ge_validation -   Validating fct_trips...
Calculating Metrics:   0%|          | 0/57 [00:00<?, ?it/s]Calculating Metrics:   0%|          | 0/57 [00:00<?, ?it/s]Calculating Metrics:   0%|          | 0/57 [00:00<?, ?it/s]Calculating Metrics:   0%|          | 0/57 [00:00<?, ?it/s]Calculating Metrics:   0%|          | 0/57 [00:00<?, ?it/s]Calculating Metrics:   2%|▁         | 1/57 [00:00<00:02, 21.48it/s]Calculating Metrics:   2%|▁         | 1/57 [00:00<00:03, 17.93it/s]Calculating Metrics:   2%|▁         | 1/57 [00:00<00:03, 14.61it/s]Calculating Metrics:   2%|▁         | 1/57 [00:00<00:04, 12.38it/s]Calculating Metrics:   2%|▁         | 1/57 [00:00<00:05, 10.62it/s]Calculating Metrics:   2%|▁         | 1/57 [00:00<00:05, 10.60it/s]Calculating Metrics:   2%|▁         | 1/57 [00:00<00:05, 10.59it/s]
[32m2026-01-08 16:40:58 -0700[0m - dagster - [34mWARNING[0m - monthly_ingestion - ca689360-9d5b-4cee-be68-4d926d9be3b8 - monthly_ge_validation -     ❌ fct_trips failed
[32m2026-01-08 16:40:58 -0700[0m - dagster - [34mWARNING[0m - monthly_ingestion - ca689360-9d5b-4cee-be68-4d926d9be3b8 - monthly_ge_validation -       Failed expectations: 9
[32m2026-01-08 16:40:58 -0700[0m - dagster - [34mWARNING[0m - monthly_ingestion - ca689360-9d5b-4cee-be68-4d926d9be3b8 - monthly_ge_validation -         - expect_table_row_count_to_be_between
[32m2026-01-08 16:40:58 -0700[0m - dagster - [34mWARNING[0m - monthly_ingestion - ca689360-9d5b-4cee-be68-4d926d9be3b8 - monthly_ge_validation -         - expect_column_values_to_not_be_null
[32m2026-01-08 16:40:58 -0700[0m - dagster - [34mWARNING[0m - monthly_ingestion - ca689360-9d5b-4cee-be68-4d926d9be3b8 - monthly_ge_validation -         - expect_column_values_to_be_unique
[32m2026-01-08 16:40:58 -0700[0m - dagster - [34mINFO[0m - monthly_ingestion - ca689360-9d5b-4cee-be68-4d926d9be3b8 - monthly_ge_validation - 
📊 Validation Summary for 2025-07:
  ✅ Passed: 0/5
  ❌ Failed: 5/5
[32m2026-01-08 16:40:58 -0700[0m - dagster - [34mWARNING[0m - monthly_ingestion - ca689360-9d5b-4cee-be68-4d926d9be3b8 - monthly_ge_validation - ⚠️ 5 validation suite(s) failed: stg_yellow_taxi, stg_fhv_taxi, stg_citibike__trips, stg_weather__hourly, fct_trips
[32m2026-01-08 16:40:58 -0700[0m - dagster - [34mWARNING[0m - monthly_ingestion - ca689360-9d5b-4cee-be68-4d926d9be3b8 - monthly_ge_validation - Pipeline will continue, but data quality issues should be investigated
[32m2026-01-08 16:40:58 -0700[0m - dagster - [34mINFO[0m - monthly_ingestion - ca689360-9d5b-4cee-be68-4d926d9be3b8 - monthly_ge_validation - ✓ Great Expectations validation complete for 2025-07
[32m2026-01-08 16:40:58 -0700[0m - dagster - [34mDEBUG[0m - monthly_ingestion - ca689360-9d5b-4cee-be68-4d926d9be3b8 - 49984 - monthly_ge_validation - STEP_OUTPUT - Yielded output "result" of type "dict". (Type check passed).
[32m2026-01-08 16:40:58 -0700[0m - dagster - [34mDEBUG[0m - monthly_ingestion - ca689360-9d5b-4cee-be68-4d926d9be3b8 - monthly_ge_validation - Writing file at: /Users/brandoncgay/Documents/Projects/nyc-mobility-weather-analytics/tmpjnvmf9r0/storage/monthly_ge_validation using PickledObjectFilesystemIOManager...
[32m2026-01-08 16:40:58 -0700[0m - dagster - [34mDEBUG[0m - monthly_ingestion - ca689360-9d5b-4cee-be68-4d926d9be3b8 - 49984 - monthly_ge_validation - ASSET_MATERIALIZATION - Materialized value monthly_ge_validation.
[32m2026-01-08 16:40:58 -0700[0m - dagster - [34mDEBUG[0m - monthly_ingestion - ca689360-9d5b-4cee-be68-4d926d9be3b8 - 49984 - monthly_ge_validation - HANDLED_OUTPUT - Handled output "result" using IO manager "io_manager"
[32m2026-01-08 16:40:58 -0700[0m - dagster - [34mDEBUG[0m - monthly_ingestion - ca689360-9d5b-4cee-be68-4d926d9be3b8 - 49984 - monthly_ge_validation - STEP_SUCCESS - Finished execution of step "monthly_ge_validation" in 12.41s.
